{
    "runId":  "2026-08-21-rebuild-4c4f5ee-repeat",
    "goal":  "Confirm origin/main is current at 4c4f5ee, rebuild the current source, and recreate the complete local Docker Compose stack",
    "approval":  {
                     "evidence":  "User explicitly requested pull and rebuild on 2026-08-21",
                     "scope":  [
                                   "inspect branch and working tree",
                                   "pull origin/main using fast-forward only",
                                   "validate Compose configuration",
                                   "build current source into Docker images",
                                   "recreate Compose services without deleting volumes",
                                   "verify migration state, health, served frontend assets, and runtime logs"
                               ],
                     "exclusions":  [
                                        "production deployment",
                                        "destructive data or volume removal",
                                        "discarding unrelated local untracked files",
                                        "exposing secret values"
                                    ]
                 },
    "mode":  "loop",
    "status":  "completed",
    "currentNode":  null,
    "nodes":  [
                  {
                      "id":  "pull",
                      "dependsOn":  [

                                    ],
                      "status":  "completed",
                      "attempt":  1,
                      "maxAttempts":  2,
                      "successConditions":  [
                                                "Local main matches latest origin/main without overwriting local files"
                                            ],
                      "evidence":  [
                                       "git pull --ff-only reported Already up to date",
                                       "Repository remained at 4c4f5ee",
                                       "Untracked run evidence and .claude/settings.local.json were preserved"
                                   ],
                      "nextAction":  null,
                      "failureClass":  null
                  },
                  {
                      "id":  "build-recreate",
                      "dependsOn":  [
                                        "pull"
                                    ],
                      "status":  "completed",
                      "attempt":  2,
                      "maxAttempts":  3,
                      "successConditions":  [
                                                "Images build from current source and all services recreate successfully"
                                            ],
                      "evidence":  [
                                       "Compose config validation passed",
                                       "docker compose --env-file .env up -d --build --force-recreate --wait built current source",
                                       "A transient Docker Desktop API 500 interrupted the first wait after images and most services were recreated",
                                       "Docker daemon immediately reported healthy and API/worker/scheduler were healthy",
                                       "A bounded recovery run of docker compose --env-file .env up -d --wait started web and completed successfully",
                                       "Migration container exited 0; migrations 069 and 070 were already applied"
                                   ],
                      "nextAction":  null,
                      "failureClass":  null
                  },
                  {
                      "id":  "verify",
                      "dependsOn":  [
                                        "build-recreate"
                                    ],
                      "status":  "completed",
                      "attempt":  1,
                      "maxAttempts":  3,
                      "successConditions":  [
                                                "All services healthy, expected frontend bundle served, HTTP smoke checks pass, and logs are clean"
                                            ],
                      "evidence":  [
                                       "postgres, redis, mailpit, api, worker, scheduler, and web reported healthy",
                                       "Frontend serves /assets/index-BlDwrEut.js and /assets/index-CDRBZVtC.css",
                                       "Web health, API liveness, API readiness, and Mailpit returned HTTP 200",
                                       "Database and Redis readiness checks returned ok",
                                       "No application error, fatal, or unhandled exception patterns found after rebuild"
                                   ],
                      "nextAction":  null,
                      "failureClass":  null
                  }
              ],
    "schedule":  null,
    "evidence":  [
                     "Repository HEAD is 4c4f5ee variable-ux completion_gate: close verified remediation",
                     "Remote had no newer commit",
                     "Complete stack was rebuilt/recreated and recovered from one transient Docker API error",
                     "No named volumes were removed and no destructive action was performed"
                 ],
    "blocker":  null,
    "updatedAt":  "2026-08-21T07:54:00Z"
}
